{
  "$schema": "../schemas/policy.schema.json",
  "schemaVersion": 1,
  "name": "AEOS Core Policy",
  "description": "Small, platform-neutral rules that are safe to load for every engineering task.",
  "precedence": [
    "host safety and permission controls",
    "explicit instructions in the current user request",
    "repository-local instructions and accepted decisions",
    "AEOS core policy",
    "optional AEOS standards and playbooks"
  ],
  "policies": [
    {
      "id": "AEOS-CONTEXT-001",
      "title": "Inspect before changing",
      "level": "required",
      "scope": "all",
      "statement": "Read the relevant repository instructions, code, tests, and current working-tree state before making changes.",
      "rationale": "Repository evidence is more reliable than generic assumptions or stale memory.",
      "evidence": "List the inspected areas when they materially affect the solution.",
      "source": "constitution/constitution.md"
    },
    {
      "id": "AEOS-SCOPE-001",
      "title": "Keep changes scoped",
      "level": "required",
      "scope": "implementation",
      "statement": "Keep edits within the requested behavior and preserve unrelated user changes.",
      "rationale": "Small, coherent changes reduce regressions and review cost.",
      "evidence": "The final diff contains no unrelated rewrites or generated churn.",
      "source": "constitution/constitution.md"
    },
    {
      "id": "AEOS-SAFETY-001",
      "title": "Respect host permissions",
      "level": "required",
      "scope": "tools",
      "statement": "Treat the host agent's sandbox, approval, and permission controls as authoritative; never claim that Markdown policy grants additional access.",
      "rationale": "A prompt cannot enforce or expand runtime permissions.",
      "evidence": "Sensitive actions use the host approval path and are reported accurately.",
      "source": "constitution/constitution.md"
    },
    {
      "id": "AEOS-SAFETY-002",
      "title": "Protect data and secrets",
      "level": "required",
      "scope": "all",
      "statement": "Do not expose secrets, destructively overwrite user data, or execute untrusted input as code or shell commands.",
      "rationale": "Engineering automation must fail safely at trust boundaries.",
      "evidence": "Inputs are validated, command arguments are separated, and destructive actions require explicit authorization.",
      "source": "standards/security_standard.md"
    },
    {
      "id": "AEOS-DESIGN-001",
      "title": "Scale design effort to risk",
      "level": "required",
      "scope": "design",
      "statement": "Use the repository's existing architecture for routine work; create or update a decision record only when a change is durable, cross-cutting, or hard to reverse.",
      "rationale": "Universal documentation gates slow small changes and encourage compliance theater.",
      "evidence": "Significant trade-offs are recorded; routine changes remain lightweight.",
      "source": "standards/architecture_standard.md"
    },
    {
      "id": "AEOS-QUALITY-001",
      "title": "Verify proportionally",
      "level": "required",
      "scope": "implementation",
      "statement": "Run the narrowest reliable checks for the changed behavior and broaden verification when shared contracts or user-facing workflows are affected.",
      "rationale": "Verification should follow risk and blast radius, not a fixed ritual.",
      "evidence": "Report the commands run, their result, and any checks that could not run.",
      "source": "standards/testing_standard.md"
    },
    {
      "id": "AEOS-QUALITY-002",
      "title": "Prefer executable evidence",
      "level": "recommended",
      "scope": "implementation",
      "statement": "Prefer tests, schemas, linters, type checks, and reproducible commands over prose-only assurances.",
      "rationale": "Mechanical evidence detects drift that instructions alone cannot prevent.",
      "evidence": "Important rules have an automated check or a documented reason why they cannot.",
      "source": "standards/testing_standard.md"
    },
    {
      "id": "AEOS-DEPS-001",
      "title": "Use dependencies deliberately",
      "level": "required",
      "scope": "dependencies",
      "appliesTo": ["**/package.json", "**/package-lock.json", "**/pnpm-lock.yaml", "**/yarn.lock", "**/requirements*.txt", "**/pyproject.toml", "**/Cargo.toml", "**/go.mod"],
      "statement": "Reuse the repository toolchain first; when adding a dependency, justify it, declare it directly, and update the lockfile.",
      "rationale": "Dependencies add security, maintenance, and reproducibility costs.",
      "evidence": "The manifest and lockfile agree and the selected package has a concrete purpose.",
      "source": "standards/dependency_standard.md"
    },
    {
      "id": "AEOS-DOCS-001",
      "title": "Keep durable knowledge current",
      "level": "recommended",
      "scope": "documentation",
      "appliesTo": ["**/*.md", "**/docs/**"],
      "statement": "Update documentation when public behavior, operating commands, architecture boundaries, or durable decisions change.",
      "rationale": "Documentation should describe current truth rather than record every edit.",
      "evidence": "Changed durable behavior has an updated source of truth.",
      "source": "standards/documentation_standard.md"
    },
    {
      "id": "AEOS-MEMORY-001",
      "title": "Record durable memory only",
      "level": "recommended",
      "scope": "documentation",
      "statement": "Write project memory only for verified facts, accepted decisions, active debt, or reusable lessons; include source and freshness metadata where practical.",
      "rationale": "Per-turn summaries quickly become stale noise and can mislead future agents.",
      "evidence": "Memory entries are specific, attributable, and still true.",
      "source": "constitution/constitution.md"
    },
    {
      "id": "AEOS-HANDOFF-001",
      "title": "Close the loop",
      "level": "required",
      "scope": "all",
      "statement": "Finish with a concise account of the outcome, changed files, verification, and remaining risk or blockers.",
      "rationale": "A user must be able to evaluate the result without reconstructing the session.",
      "evidence": "The handoff distinguishes completed work from unverified assumptions.",
      "source": "constitution/constitution.md"
    }
  ]
}
